{
  "stage": 7,
  "layer": "robustness",
  "vintage": "2026-10-30",
  "generated_at": "2026-10-30T15:42:29+0100",
  "generator": "analysis/R/04_robustness.R",
  "spec": "analysis/specs/robustness.yml",
  "verifier": "tests/verify_stage7.py",
  "input": {
    "database": "data/analytics.duckdb",
    "panel_table": "main_analytics.state_panel",
    "national_faac_table": "main_analytics.faac_national_monthly",
    "fact_metric_table": "main_analytics.fact_metric",
    "oil_metric_id": "oil"
  },
  "upstream": {
    "estimates": "registry/estimates/2026-10-30/estimates.json",
    "preferred_matches_stage6": {
      "checked": true,
      "design_a": {
        "stage6": 0.46781005778,
        "robustness": 0.46781005778,
        "abs_diff": 3.8454794904e-12
      },
      "design_b": {
        "stage6": 0.51811762897,
        "robustness": 0.51811762897,
        "abs_diff": 4.2567060987e-12
      },
      "tolerance": 1e-08
    }
  },
  "grid": {
    "design_a": {
      "n": 81,
      "axes": {
        "outcome": ["fatalities", "incidents", "fatalities_civilians"],
        "dose_lag_months": [0, 1, 2],
        "adjustment_set": ["state_fe", "state_month_fe", "state_month_fe_state_trend"],
        "window": ["full", "exclude_covid", "post_2019"]
      }
    },
    "design_b": {
      "n": 48,
      "axes": {
        "outcome": ["faac", "cpi"],
        "shock": ["d_log_oil_1m", "d_log_oil_3m"],
        "controls": ["none", "month_of_year", "month_of_year_plus_lagged_shock", "month_of_year_plus_covid"],
        "window": ["full", "exclude_covid", "post_2019"]
      },
      "focus_horizon": 2
    },
    "n_total": 129
  },
  "preferred": {
    "A": "A|fatalities|lag0|state_month_fe|full",
    "B": "B|faac|d_log_oil_1m|month_of_year|full",
    "rule": "the specification pre-registered in estimation.yml; marked, not selected by the grid",
    "design_a": {
      "coefficient": 0.46781005778,
      "standard_error": 0.28118111593,
      "ci_low": -0.08330492943,
      "ci_high": 1.018925045,
      "n_obs": 3888
    },
    "design_b": {
      "coefficient": 0.51811762897,
      "standard_error": 0.16642068273,
      "ci_low": 0.19193309083,
      "ci_high": 0.84430216712,
      "n_obs": 111
    }
  },
  "base_fingerprint": {
    "why": "Reads the tables the grid actually uses at 10 significant digits. A mismatch means the artifact was fitted on a different base than the one on disk — re-run analysis/R/04_robustness.R. This is the C-44 invariant (an artifact describing a vintage other than the current one) applied to the base rather than to a report label.",
    "queries": {
      "state_panel": "select md5(string_agg(s, '|' order by s)) from (select printf('%s|%s|%s|%.10g|%.10g|%.10g|%.10g|%s', state_id::VARCHAR, strftime(period_month, '%Y-%m'), dose_status, faac_gross_total_naira::DOUBLE, fatalities::DOUBLE, incidents::DOUBLE, fatalities_civilians::DOUBLE, security_status) as s from main_analytics.state_panel) t",
      "faac_national_monthly": "select md5(string_agg(s, '|' order by s)) from (select printf('%s|%.10g|%d', strftime(period_month, '%Y-%m'), gross_total_naira, n_beneficiaries) as s from main_analytics.faac_national_monthly) t",
      "oil_series": "select md5(string_agg(s, '|' order by s)) from (select printf('%s|%.10g', strftime(period_month, '%Y-%m'), value) as s from main_analytics.fact_metric where metric_id = 'oil') t"
    },
    "values": {
      "state_panel": "f526357c180733fc4da2340bd4b9fd77",
      "faac_national_monthly": "0084ea1d7129badee024d3483e5ce6c2",
      "oil_series": "167ff0dce42d45c06461f4393d69de01"
    }
  },
  "support": {
    "rule": {
      "sign": "positive if coefficient > 0, negative if < 0, exact zero counted separately",
      "interval": "a specification 'supports' a sign beyond zero only if its 95 % interval excludes zero on that side",
      "note": "The count is descriptive, not a vote. The specifications are deliberately correlated — the same 3,888 rows, the same outcome and overlapping windows — so a positive count is a statement about the grid, not that many independent pieces of evidence. It is published as a count, never as a share of evidence, and never as a probability that the sign is right. The tally itself is read from the fitted rows, never typed — the revision pass of 2026-10-30 moved it, and a literal here would have gone stale silently (C-82, C-83).",
      "near_zero_band": 0.02,
      "near_zero_why": "0.02 is a few per cent of the pre-registered Design A coefficient — below it, a specification contributes nothing to a statement about direction, and a count that moved when such a cell flipped would be a count of floating-point noise. Members of the band are published as a subset of both signs, never removed: `n_positive` still counts them, and `n_near_zero` says how many of those are the ones the reader should not interpret. The coefficient the band is a fraction of is not typed here: it moved when the UCDP history was revised (C-82) and a typed copy would have gone stale silently."
    },
    "overall": {
      "n": 129,
      "n_positive": 96,
      "n_negative": 33,
      "n_zero": 0,
      "n_positive_ci": 56,
      "n_negative_ci": 0,
      "n_near_zero": 24,
      "n_positive_outside_band": 82,
      "n_negative_outside_band": 23
    },
    "by_design": {
      "A": {
        "n": 81,
        "n_positive": 60,
        "n_negative": 21,
        "n_zero": 0,
        "n_positive_ci": 32,
        "n_negative_ci": 0,
        "n_near_zero": 2,
        "n_positive_outside_band": 58,
        "n_negative_outside_band": 21
      },
      "B": {
        "n": 48,
        "n_positive": 36,
        "n_negative": 12,
        "n_zero": 0,
        "n_positive_ci": 24,
        "n_negative_ci": 0,
        "n_near_zero": 22,
        "n_positive_outside_band": 24,
        "n_negative_outside_band": 2
      }
    },
    "by_axis_level": [
      {
        "design": "A",
        "axis": "outcome",
        "level": "fatalities",
        "is_preferred_level": true,
        "n": 27,
        "n_positive": 21,
        "n_negative": 6,
        "n_positive_ci": 8,
        "n_negative_ci": 0,
        "n_opposite": 6,
        "flips_against_preferred": false
      },
      {
        "design": "A",
        "axis": "outcome",
        "level": "fatalities_civilians",
        "is_preferred_level": false,
        "n": 27,
        "n_positive": 12,
        "n_negative": 15,
        "n_positive_ci": 0,
        "n_negative_ci": 0,
        "n_opposite": 15,
        "flips_against_preferred": true
      },
      {
        "design": "A",
        "axis": "outcome",
        "level": "incidents",
        "is_preferred_level": false,
        "n": 27,
        "n_positive": 27,
        "n_negative": 0,
        "n_positive_ci": 24,
        "n_negative_ci": 0,
        "n_opposite": 0,
        "flips_against_preferred": false
      },
      {
        "design": "A",
        "axis": "dose_lag_months",
        "level": "0",
        "is_preferred_level": true,
        "n": 27,
        "n_positive": 23,
        "n_negative": 4,
        "n_positive_ci": 12,
        "n_negative_ci": 0,
        "n_opposite": 4,
        "flips_against_preferred": false
      },
      {
        "design": "A",
        "axis": "dose_lag_months",
        "level": "1",
        "is_preferred_level": false,
        "n": 27,
        "n_positive": 17,
        "n_negative": 10,
        "n_positive_ci": 8,
        "n_negative_ci": 0,
        "n_opposite": 10,
        "flips_against_preferred": false
      },
      {
        "design": "A",
        "axis": "dose_lag_months",
        "level": "2",
        "is_preferred_level": false,
        "n": 27,
        "n_positive": 20,
        "n_negative": 7,
        "n_positive_ci": 12,
        "n_negative_ci": 0,
        "n_opposite": 7,
        "flips_against_preferred": false
      },
      {
        "design": "A",
        "axis": "adjustment_set",
        "level": "state_fe",
        "is_preferred_level": false,
        "n": 27,
        "n_positive": 22,
        "n_negative": 5,
        "n_positive_ci": 7,
        "n_negative_ci": 0,
        "n_opposite": 5,
        "flips_against_preferred": false
      },
      {
        "design": "A",
        "axis": "adjustment_set",
        "level": "state_month_fe",
        "is_preferred_level": true,
        "n": 27,
        "n_positive": 23,
        "n_negative": 4,
        "n_positive_ci": 10,
        "n_negative_ci": 0,
        "n_opposite": 4,
        "flips_against_preferred": false
      },
      {
        "design": "A",
        "axis": "adjustment_set",
        "level": "state_month_fe_state_trend",
        "is_preferred_level": false,
        "n": 27,
        "n_positive": 15,
        "n_negative": 12,
        "n_positive_ci": 15,
        "n_negative_ci": 0,
        "n_opposite": 12,
        "flips_against_preferred": false
      },
      {
        "design": "A",
        "axis": "window",
        "level": "exclude_covid",
        "is_preferred_level": false,
        "n": 27,
        "n_positive": 21,
        "n_negative": 6,
        "n_positive_ci": 11,
        "n_negative_ci": 0,
        "n_opposite": 6,
        "flips_against_preferred": false
      },
      {
        "design": "A",
        "axis": "window",
        "level": "full",
        "is_preferred_level": true,
        "n": 27,
        "n_positive": 21,
        "n_negative": 6,
        "n_positive_ci": 11,
        "n_negative_ci": 0,
        "n_opposite": 6,
        "flips_against_preferred": false
      },
      {
        "design": "A",
        "axis": "window",
        "level": "post_2019",
        "is_preferred_level": false,
        "n": 27,
        "n_positive": 18,
        "n_negative": 9,
        "n_positive_ci": 10,
        "n_negative_ci": 0,
        "n_opposite": 9,
        "flips_against_preferred": false
      },
      {
        "design": "B",
        "axis": "outcome",
        "level": "cpi",
        "is_preferred_level": false,
        "n": 24,
        "n_positive": 12,